{
  "id": "7b8c9d0e-0000-4000-8000-000000000006",
  "uri": "https://grip.opdrachtnemer.example/id/vacature/7b8c9d0e-0000-4000-8000-000000000006",
  "organisation": {
    "tooi_uri": "https://identifier.overheid.nl/tooi/id/oorg/oorg00000",
    "name": "Voorbeelddienst",
    "unit_key": "voorbeeldgilde",
    "instance_uri": "https://grip.opdrachtnemer.example"
  },
  "assignment_uri": null,
  "role": "Developer",
  "description": "Fictief profiel.",
  "rate_category": "C",
  "fte": "1.0",
  "period": {
    "start_date": "2026-07-01",
    "end_date": "2027-06-30"
  },
  "status": "open",
  "contact_email": "vacatures@opdrachtnemer.example",
  "respond_by": "2026-06-15",
  "published_at": "2026-05-25T08:00:00+02:00"
}
